id,created_at,text
1179366200167542785,2019-10-02 12:03:08,"These are brave words, and harken to a kind of conservatism that build walls with caution and ensures they have wid… https://t.co/V66ZRT3pV1"
1179196754576789504,2019-10-02 00:49:49,"This US journalist, who is not accused (by anyone) of any... https://t.co/2K3Ggc5QGg"
1178029803779297281,2019-09-28 19:32:46,"The Fairness for High Skill Immigrants Act enjoys widespread, bipartisan support. It is good for American competiti… https://t.co/9TEkOsWZlY"
1177386969162289152,2019-09-27 00:58:22,https://t.co/ZrT4GYLnI8
1176807916063662080,2019-09-25 10:37:25,Kathleen Bruinsma is definitely someone who fits in the mold of always standing up for her beliefs and working for… https://t.co/YTSngij48R
1176498324419031040,2019-09-24 14:07:13,This quote from War &amp; Peace. https://t.co/CWBHJqvcs1
1175486602975600640,2019-09-21 19:07:00,#YasuakiOnishi — at Bellagio Las Vegas https://t.co/2Q4gO6aEOT
1175477768710176771,2019-09-21 18:31:54,Your name in lights. — at The Neon Museum https://t.co/oiJLNdADTM
1175069021361848321,2019-09-20 15:27:41,"""We are not sure the F.B.I. is taking its obligations under USA Freedom seriously, "" dryly quipped one EFF attorney. https://t.co/5gaYB2io3S"
1174294336395251713,2019-09-18 12:09:21,This breaking news of the NY Fed jumping into the repo market in this kind of way is... concerning. They haven't re… https://t.co/ULYUwTcURb
1173214133967347714,2019-09-15 12:37:01,"Michigan bridges, of all infrastructure challenges, have among the highest potential to result in loss of human lif… https://t.co/ffb0T6HaxJ"
1171864920931164160,2019-09-11 19:15:44,"Nausea inducing quote: ""the swimmer from Dimond High School competed in four events at the meet on Friday, but was… https://t.co/3IkzPHlxfr"
1171518887197732866,2019-09-10 20:20:43,"""The devil has enough advocates.""
—Marcus Littles,
Frontline Solutions"
1171442781119602688,2019-09-10 15:18:18,Quelle suprise. Uptick of uninsured Americans of 6 tenths of a percent through full year 2018. https://t.co/4gSOk27hz9
1170109314226425856,2019-09-06 22:59:34,"This is shameful. Thank you, Miriam. https://t.co/vMgQIygGcg"
1169926335747252226,2019-09-06 10:52:29,"Propublica's reporting found evidence of ~60 crashes since 2015, with 10 deaths and 45 lawsuits, although the compl… https://t.co/VOd805NGzx"
1169380833700012033,2019-09-04 22:44:51,https://t.co/fsSX7P0fmR
1169319983299682305,2019-09-04 18:43:03,This is the first case I've heard of an extremely restrictive diet (of the kind often seen in autism) went far enou… https://t.co/anyR9Ge5NE
1168663488379719685,2019-09-02 23:14:23,"It looks like the actual journal article is not actually available even via PNAS early access yet, but I am definit… https://t.co/TH0uOfXh7h"
1168598983062609924,2019-09-02 18:58:03,Claw-veland rocks art! #CatcationVolumeIII — at The Cleveland Museum of Art https://t.co/oGojibHg6l
1168502073618513920,2019-09-02 12:32:58,"One of the participants enrolled in Habitat for Humanity to rehab and move into a new home with her 7yo and 9yo:

""… https://t.co/vMDyuthTjE"
1165985120672735233,2019-08-26 13:51:30,"Hey guys! We just want to thank you for the excellent beer, tasty food, and the outstanding hospitality from Jazz a… https://t.co/JtN8YHii58"
1164534204392230913,2019-08-22 13:46:04,Are you all using this app and didn't tell me about it? It's $15/yr paid feature looks easily worth the price. How… https://t.co/zDOPEw3Maj
1162687679944953856,2019-08-17 11:28:39,¡Gracias por los mejores aguacates del mundo! https://t.co/esFKJ3jUSS
1162501947510992904,2019-08-16 23:10:37,#BossBabe required reading. https://t.co/KAaSqQhCF8
1161956737768927232,2019-08-15 11:04:09,This story (also on p. 50 of the physical magazine) exemplifies how broken the asylum system in the U.S. is. A Clin… https://t.co/Ybykn1AJst
1161953593492221954,2019-08-15 10:51:39,"This is a really remarkable read about Ms. May and her three loves: the environment, family planning, and the anti-… https://t.co/07DzNSGUgE"
1161949126617120768,2019-08-15 10:33:54,"While you're looking at their behinds, beware that women may kick yours. https://t.co/lFXmOVlIWA"
1161037861501788161,2019-08-12 22:12:51,"""Write with blood, and thou wilt find that blood is spirit""
Thus spake Zarathustra"
1160588654466740226,2019-08-11 16:27:52,I can't believe I had the chance to go to grad school with people as amazing as Vonetta Jones Dotson.
1160567216779255813,2019-08-11 15:02:41,This primary source reporting from #WaPo a couple of days... https://t.co/kWQiIybFp8
1160260473977278465,2019-08-10 18:43:48,"""What we cannot forget about is that straight up empathy is wildly effective.""
—Lisa Damour
#APAConvention2019"
1160238255318753280,2019-08-10 17:15:30,This might be a really valuable model of compromise in the public space. https://t.co/xJ20pIDOgX
1159541976867508225,2019-08-08 19:08:45,Let me #HumbleBrag about Erin Deneke. So excited about her session. #APA #Division44
1159119994610966528,2019-08-07 15:11:56,"Thankful to have leaders in these areas in our community and opportunities to collaborate with them. Like Fishbeck,… https://t.co/pWclDfo1yr"
1159088027311976448,2019-08-07 13:04:55,Hey you guys!!!! Wade Rouse is going to be interviewing Rita Mae Brown on 9/5 at SCA! Tickets available now.
1159087435869032449,2019-08-07 13:02:34,https://t.co/gsvRWp2pbc
1159064713961070592,2019-08-07 11:32:16,https://t.co/CG3BgJGjVx
1157304625730588678,2019-08-02 14:58:19,"I've beaten this drum before, but these kinds of calculators and the social psychology behind perceptions of relati… https://t.co/uYXoto6Ym4"
1157281001640538113,2019-08-02 13:24:26,"Mr. Hurd's direct, hands-on experience as a legislator from the border, his high-tech background with the CIA, and… https://t.co/AFlm0BABw5"
1156518869747589120,2019-07-31 10:56:00,"Just to be clear — John Delaney is NOT the guy from CSI:Miami, correct?"
1156197173358465024,2019-07-30 13:37:41,Next Tuesday is a primary ballot for GR (and other communities). Some info for GR peeps. https://t.co/ECwuZvv7py
1156152857357430785,2019-07-30 10:41:36,"""The threats to our democracy are not imagined, they are real. But there is a fundamental decency to the vast major… https://t.co/vi5iZF1DMZ"
1154343607538716673,2019-07-25 10:52:17,"I'm not against this, necessarily, even if it means I will pay another $5-6k in taxes, but I am against a graduatio… https://t.co/LnZ5t9pyv1"
1154160060051972096,2019-07-24 22:42:56,"Thank you so much, West Michigan Woman for the opportunity to tell a little bit of my story!!! https://t.co/fQIfVgxM3Q"
1153978056358473729,2019-07-24 10:39:43,"CBS's new data is fascinating. I have concerns about dividing Dems on how ""liberal"" they are, and assuming that lib… https://t.co/xLoaC8byv7"
1153771530159120386,2019-07-23 20:59:03,"We might be a little late tonight, but we are glad to support Wendy, who has done so much for our City. Come join u… https://t.co/ZActUC3rEo"
1153477590457430021,2019-07-23 01:31:02,A moving and compelling take on the US felony murder rule (Michigan's felony murder rule fell in 1980 via a court d… https://t.co/v7U6Qrovia
1153287811212173312,2019-07-22 12:56:55,"This particular statistic is amazing. Russia, Canada, and the USA - just these three countries together - are estim… https://t.co/IFSDg4SujV"
1153280778530435073,2019-07-22 12:28:59,"Raj Chetty, himself a participant in the American Dream, is uniquely poised to understand and help maximize the fut… https://t.co/qtSmOl6Kdg"
1153015443000614912,2019-07-21 18:54:38,"Thank you for your leadership on this issue, Brian Calley. https://t.co/N8dGC7gW6g"
1152233792918175744,2019-07-19 15:08:38,"""If we like someone, we're gonna take 'em to heaven.
If we like a pair of shoes, we're gonna buy eleven."" https://t.co/NVR0zAi5wc"
1151912673866649601,2019-07-18 17:52:37,"Just realizing there is actually a ""FaceApp"" and it's not like when people say sportsball."
1151814948428926977,2019-07-18 11:24:18,Original reporting worth reading. The near term mission landscape changes mean more collaboration between Special O… https://t.co/LfyuJE4XF1
1151616861957525504,2019-07-17 22:17:10,"Please join us in support of our fierce advocate in LA sing, Rel. Hood. https://t.co/oXFcWCiZS8"
1151160681384861696,2019-07-16 16:04:28,We are less for being robbed of this gentle woman and fearsome advocate and historian. https://t.co/azAJ6SUd6R
1151122613592363009,2019-07-16 13:33:12,Apparently the terrorists were trying to sell an *air-to-air* missile without an explosive charge / warhead over Th… https://t.co/Xmq4Cuuqqj
1150935867013455872,2019-07-16 01:11:08,"""If our souls met—yours and mine—they’d fight to the death. But after they had torn each other to pieces, to the ve… https://t.co/XRLv4oGMB8"
1150542445463121920,2019-07-14 23:07:49,"AMLO has not been playing games when it comes to slashing waste … the President flies economy, has set his own sala… https://t.co/2BWymKm82R"
1150430345076101120,2019-07-14 15:42:22,"We were unexpectedly taken, in particular, with Ali Banisadr's evocative not-so-abstract art.

The lobby installati… https://t.co/MJKTYUQQSr"
1150385814272204801,2019-07-14 12:45:25,This loophole should be closed. There just isn't any need for it in the modern economy. https://t.co/P9trg0HUp1
1150005541768486912,2019-07-13 11:34:21,Al Letson's one man story about his own experience covering and then finding himself in the middle of protest... https://t.co/JzkrGuquhw
1149832586048475137,2019-07-13 00:07:06,Thank you Senator Winnie Brinks! https://t.co/ap7erRzJcS
1149778375986372609,2019-07-12 20:31:41,"This is worth reading for the story of Ms. Nuetzl, a 60-year-old ""natural born"" US citizen from Gainesville/Ocala,… https://t.co/pMZ81rs44T"
1148936142391259141,2019-07-10 12:44:57,"The watchful among you may notice that we are still not married, for which I and the Mister humbly apologize. We wi… https://t.co/cYaSggYCpV"
1148185511271567360,2019-07-08 11:02:12,The Federalist is surprisingly sensible on this. It seems to be Ms. David's first piece with them (I'm not sure if… https://t.co/Nua4fvJj40
1147924825622679552,2019-07-07 17:46:20,"This is a dynamic group of leaders in this field, including some of my friends (and inspirations)! If you can make… https://t.co/zXJt03BBma"
1147493257317928962,2019-07-06 13:11:26,To live freely is the hardest and worthiest of human aspirations. https://t.co/IWi6mr5pY0
1147092357420113920,2019-07-05 10:38:24,"My parents didn't leave anything like Ms. Kanzer's situation in the dying Soviet Union, but like me, I bet almost e… https://t.co/1ekhMeskWq"
1146868259750383617,2019-07-04 19:47:55,This analysis of Subway's business practices is really interesting... and worrisome. The company is so non-transpar… https://t.co/kbOC1pyOdy
1146500199394791424,2019-07-03 19:25:23,I had a dream last night where we were searching for Iago and wound up in a pool hall chatting to a nonbinary perso… https://t.co/NtCnEUKm3q
1146484540824870912,2019-07-03 18:23:09,My credit score is four years higher than it was and the problem with the way we do things looks four times worse. https://t.co/QJkrtitL7o
1146367485266071552,2019-07-03 10:38:01,A really good move at the ECB. https://t.co/jMea3Ux3IG
1146036069223280640,2019-07-02 12:41:05,DRM-stripping for personal use should be legal... the DMCA has always been wrong about this. https://t.co/Wwj3OXaOxc
1146035363670102017,2019-07-02 12:38:17,"When it comes to Confederate statues, the approach I've supported has been removal and recontextualization, which h… https://t.co/U7nHNzPmYK"
1145380362765393922,2019-06-30 17:15:33,"This was brilliant. ""When I say Marsha you say P.! When I say fami- you say -ly!"" https://t.co/57JmUvUZWY"
1144576637004070914,2019-06-28 12:01:50,"The way that Microsoft rolls these things out is still so confusing. Of the three PCs I use running Windows 10 Pro,… https://t.co/JCRHqLKYcI"
1144294902886535168,2019-06-27 17:22:19,"Put a new convertible with a metal roof and a panoramic sunroof on the market, preferably with a back seat, and I w… https://t.co/VC7f46g4wd"
1144191541541560321,2019-06-27 10:31:36,https://t.co/SYw5egBGu3
1142485861805809665,2019-06-22 17:33:50,Enjoying some of the new pieces here. And how funny that I just posted about children's stories only to find a wond… https://t.co/gxa9RFMDVc
1142405381513256960,2019-06-22 12:14:02,Sadly I work with children whose parents laugh (most of the time) when I ask if they will listen to a bedtime story… https://t.co/4QFJ8KztT9
1142219160853897217,2019-06-21 23:54:04,Justice Thomas's dissent against Justice Kavanaugh's opinion is absurdist even for him (I cannot believe that I am… https://t.co/Wxl0CRAMAO
1142217386919112705,2019-06-21 23:47:01,They were trying to bribe flyers to sit my flight to Norfolk out till the morning for $600. Now I had a talk to giv… https://t.co/mFyheDCL8j
1141717916590714880,2019-06-20 14:42:18,"The long arc of civilization is that the world has become a more peaceful and less bloody place, century by century… https://t.co/VKuvQzRuoi"
1141293205977255936,2019-06-19 10:34:39,I don't really watch TV but I would watch this. #AutismFamily https://t.co/6jtDLiPc9g
1140640279332118530,2019-06-17 15:20:09,Thank you Jewish Theatre Grand Rapids and Sammy AP for this challenging production and for continuing to create the… https://t.co/1S5OITffSz
1140574270495567872,2019-06-17 10:57:51,"It *is* the Federalist so who even knows if they're joking or serious (about this or anything), but, oh, what the h… https://t.co/uiwQO0Kz6I"
1140387887910936577,2019-06-16 22:37:14,I'm so thankful for the opportunity to serve and build alongside these wonderful leaders. Diversity is rightly and… https://t.co/mpEu4HIDnE
1140234018841120768,2019-06-16 12:25:49,This week's Crains Detroit Business Detroit Rising offers detailed analysis of the rhyme and reason (if there has e… https://t.co/ChfPhiSfnH
1139500073958723584,2019-06-14 11:49:23,This is an interesting analysis - Parolin's journal article is in Socio-Economic analysis. It documents the signifi… https://t.co/AtTRY6BpH6
1138759590068314112,2019-06-12 10:46:58,"First Step, a bipartisan legislative action signed into law by Mr. Trump in December, has brought freedom to 1,000… https://t.co/Qy6UebRjAo"
1138466842425659392,2019-06-11 15:23:41,That... is a major development in this story. Wow. https://t.co/02qXnF2NIL
1138397222700310528,2019-06-11 10:47:02,Museo Novecento Firenze had some amazing installations looking at the impact of climate change and the future of ur… https://t.co/TcmmECCh5N
1138156914465021952,2019-06-10 18:52:08,"Sigh. 

""Anyone who thinks that being transgender is a response to ideology...has not spoken to many transgender pe… https://t.co/KtZjF2Pmjr"
1138152369580060673,2019-06-10 18:34:05,Come have a beer with this woman who has done so much in service of Michiganders. https://t.co/F5n03puBnB
1137728501388316683,2019-06-09 14:29:47,"Out of the ton of Florentine photos I have in my camera roll, I do have to say this was a really impressive street… https://t.co/eeaLN3iqT3"
1137712947940274176,2019-06-09 13:27:59,"""One even appeared to urinate on an Israeli flag."" (Unbelievably, a British newspaper is not just saying this happe… https://t.co/qn4f3z4Bgh"
1137709916691587072,2019-06-09 13:15:56,Teri Jourdan introduced me to this song while we were driving through East Grand Rapids in my Muffy-from-the-countr… https://t.co/ib5yBjkff8
1136967087291805697,2019-06-07 12:04:12,"""We Americans are not at our best when we launch off on holy wars."" 

Become America sounds like an interesting dov… https://t.co/CBqsBXllvh"
1136583973730045952,2019-06-06 10:41:50,"An intimate look at the lives of several nonbinary Americans, including genderqueer therapist Laura Jacobs! https://t.co/wcQLs07DEo"
1135860216652849153,2019-06-04 10:45:53,There are still bipartisan bills that succeed in Washington. There are some interesting ideas here... maybe it gets… https://t.co/8KYhRCQIdE
1135528378986094594,2019-06-03 12:47:17,"Delta travelers: How's international return online check-in work? Never avail, or is it avail if 1st flight leg is op'd by Delta?"
1134519722169577472,2019-05-31 17:59:14,So excited to see Jonathan stepping up for our community! https://t.co/wJb1WMggNL
1134033741658107905,2019-05-30 09:48:07,"So sad Iago isn't with us on this trip, but #Catcation3 is already planned. https://t.co/xvZ7h7hkkI"
1132258286219268097,2019-05-25 12:13:06,Read banned books. Share banned books. End the bans. https://t.co/RshgOjk9Hz
1132257833565790208,2019-05-25 12:11:18,Read banned books. Share banned books. End the bans. https://t.co/S5b1EcD7H4
1132119392567943168,2019-05-25 03:01:11,"Fred Sebulske, Kyle Los, everyone at Actors' Theatre Grand Rapids for Sweat. Thank you so much. This is why theater matters."
1131941673385250816,2019-05-24 15:15:00,One of the downsides to the way this deal was reached is how little we know about what's in it. Thank you to the st… https://t.co/cmXCVEtnmi
1131558138925260800,2019-05-23 13:50:58,TBH I am quite curious to see with my own eyes what the mood is like on Italian ground in a few days - the EU parli… https://t.co/HZR5hxArgS
1131286298709377025,2019-05-22 19:50:46,And this is what women deal with.... https://t.co/vd6vtmAom6
1130962970413096962,2019-05-21 22:25:59,"Associations between increasing air pollution and ADHD are well established, but this is one of the first studies t… https://t.co/szSmiL1R94"
1130488203230752769,2019-05-20 14:59:25,Credit where credit is due. Justice Gorsuch and the others deserve praise for holding the US to its contractual obl… https://t.co/Lhd8DppJab
1129188326332878849,2019-05-17 00:54:10,https://t.co/kv7XesYo5y
1129014400789155840,2019-05-16 13:23:03,I've shown data from the stage and talked about how air pollution rates influence autism rates... they are known to… https://t.co/1oECKf8gpf
1128621485776691200,2019-05-15 11:21:45,It's funny that I still remember what this is talking about. Let it be a word to the wise for my friends in the non… https://t.co/rtilgfr6E1
1127633402163867648,2019-05-12 17:55:28,"The best way to celebrate Mother's Day is to fight, as mothers, on behalf of mothers, alongside mothers, against in… https://t.co/az6iPTjkBo"
1127559491548000257,2019-05-12 13:01:46,"If you don't want people to know what the measurements are, make sure you break all the rulers. https://t.co/U0ZOJWUDnK"
1126976039433928710,2019-05-10 22:23:20,https://t.co/rTdzgI3WD8
1126440374438957056,2019-05-09 10:54:48,This isn't a reasonable business practice. https://t.co/5CoX6D8pWb
1125842650693812224,2019-05-07 19:19:39,"Because we cannot work together to make common sense changes, let's just write a completely foolish bill, punt it o… https://t.co/hxzVl7C34Z"
1125820209355546627,2019-05-07 17:50:29,Best Conference Ever. #YouKnowYouWantTo https://t.co/BlASb0NTdD
1125802424172797953,2019-05-07 16:39:48,"The newly revealed exploit, from early 2016, is ""is the latest evidence that the United States has lost control of… https://t.co/EFjWOzHcYW"
1125715455400980480,2019-05-07 10:54:14,"The city of Grand Rapids does not have a local ballot today, correct? Or does it?"
1124285936626544640,2019-05-03 12:13:50,"Notwithstanding significant missteps, including the major failures surrounding the residency bribery case, this has… https://t.co/V47phNweb4"
1123899635150610433,2019-05-02 10:38:48,"Great....

I do wonder how long our government has known a high level Venezuelan official was trying to create Hezb… https://t.co/9VAHhIecEX"
1122627708050079750,2019-04-28 22:24:37,"Ask me how much I love my one-eyed cat and I will tell you, this is how much I love my one-eyed cat. #HesNotWinking #ThankYouTeri"
1122487643583991808,2019-04-28 13:08:03,"The card reads ""Ovary House"" so we're keeping it forever. #HappyBirthdayToMeDayAfterTomorrow — at Oviatt House Bed… https://t.co/AXJLF69fd3"
1121774576118239232,2019-04-26 13:54:35,"I'm known as the trauma lady. 
I'm rebranding as the resilience lady.
—Allison Sampson-Jackson
#TogetherTheVoice"
1121772258421280768,2019-04-26 13:45:22,"""I'm known as the trauma lady. 
I'm rebranding as the resilience lady.""
—Allison Sampson-Jackson
#TogetherTheVoice"
1121601672223121409,2019-04-26 02:27:31,I want to hear this one last hurrah for this brilliant star too soon extinguished. https://t.co/wlRSeocK5F
1121418448280727553,2019-04-25 14:19:27,"'There,' for me, as a kid, was simply away from here.
—Charles Hunt
#TogetherTheVoice"
1121053343068098561,2019-04-24 14:08:39,"We call our young people ""at risk.""
Let's call them ""at promise.""
—Jaiya John"
1121051373758504960,2019-04-24 14:00:50,"This man, Dr. Jaiya John, is a hero. #TogetherTheVoice"
1120878401190080512,2019-04-24 02:33:30,A lovely collection with a great focus on the global imoact of Louisiana artists! — at New Orleans Museum of Art https://t.co/mbVzFX7FgY
1120867371412000770,2019-04-24 01:49:40,Food this good should be a crime. Oh. My. God. — at Heard Dat Kitchen https://t.co/9AdW8i56Ju
1120866730350452736,2019-04-24 01:47:07,Food this good should be a crime. Oh. My. God. — at Heard Dat Kitchen https://t.co/Y4UJuAu3r5
1120806117720895488,2019-04-23 21:46:16,"Prayers for this brave sister in Christ, for wisdom for those caring for her, and continuing thankfulness for her l… https://t.co/6McYahBzvh"
1120758137944932352,2019-04-23 18:35:37,Thankful for the Herculean work of Amy at Mia Bella for upgrading my toes from deplorable to adorable! — at Mia Bel… https://t.co/A81lpD4llg
1120695334764675080,2019-04-23 14:26:03,"I missed coverage of this story in the first round (I believe WaPo, which I usually avoid, ran stories some time ag… https://t.co/KAVLNrNoP3"
1120070432479154178,2019-04-21 21:02:55,Wise words 17 years ago; wise words today. — at The Art Institute of Chicago https://t.co/VbOXIDZiAo
1119944284671594501,2019-04-21 12:41:39,The Children playfully (and artfully) runs over Earth Day and Mother's Day. It's simple and human and profound and… https://t.co/GKrQpn6Rz0
1119942108129837056,2019-04-21 12:33:00,The violence in Sri Lanka is heartbreaking. No one should be afraid to practice their religion or celebrate their h… https://t.co/oU3Ejw85H4
1119705422439636992,2019-04-20 20:52:30,Kent County keeps recycling despite turbulence https://t.co/V3j2hy3IUp
1119311903581528064,2019-04-19 18:48:48,https://t.co/xs5KgNittt
1119190589306744834,2019-04-19 10:46:44,I'm for any opportunity to do good. Let's get this done. #Tobacco21 https://t.co/x3dR2iiKdk
1118916943841583104,2019-04-18 16:39:22,Microsoft Garage Mouse without Borders is kind of amazing. #WellKeptSecret
1118916344009953280,2019-04-18 16:36:59,Microsoft Garage Mouse without Borders is amazing!
1118641746030862337,2019-04-17 22:25:50,The Complexity of Autism Spectrum Disorders | BRAINS https://t.co/wbHc9IgPJB
1118212183953952768,2019-04-16 17:58:54,Normally I stand on the shoulders of giants but this time their shoulders are in the upper row. 😁
1118207385745731589,2019-04-16 17:39:50,Great things that go together.
1117829353646243840,2019-04-15 16:37:40,I am a FREAK for Stephen Dubner. And occasionally at other times. — at The Economic Club of Grand Rapids https://t.co/FFZTzQGtJ1
1117424055852982272,2019-04-14 13:47:10,Maybe universal disclosure is the way to go again. TBH I experimented with voluntarily disclosing my own giving on… https://t.co/NV5lruIib1
1116132289099046912,2019-04-11 00:14:09,https://t.co/3rjniPf8s8
1115636146120339456,2019-04-09 15:22:39,I am so thankful I got to go back and do this a second time! https://t.co/I4XTCryP1g
1114890468574289920,2019-04-07 13:59:36,"So thankful for this Hattiloo production last night, telling the story of Black life in Nashville during the fight… https://t.co/WXl1PJdjO9"
1114733649964994561,2019-04-07 03:36:27,"Teri Jourdan looked this up and confirmed that this is a Jeff Zimmerman, the same artist who has a mural back in Gr… https://t.co/8LxUe8JdKZ"
1114593812846993408,2019-04-06 18:20:47,This bawse is brilliant like 150cc Rainbow Road. https://t.co/tInojfZv7B
1113821100490801152,2019-04-04 15:10:18,"CNN (and others) are reporting that the former CTO of Mozilla, who had Global Entry status and is a US citizen retu… https://t.co/DyeXsj5H4V"
1113601562570625024,2019-04-04 00:37:56,"""When you experience [Grace], it's like you have no enemies."" https://t.co/MZHQDw34LR"
1113200086778093568,2019-04-02 22:02:37,https://t.co/ljEravs5O4
1111955561946451968,2019-03-30 11:37:19,"""Along the side margin of the last page, she wrote, 'Needs lots more thought.'"" https://t.co/oPrKVDs2Lj"
1111951362634452993,2019-03-30 11:20:38,Redlining should be a relic. It should not find a renaissance in the digital age. https://t.co/7VEDqjoPHW
1111609938760122369,2019-03-29 12:43:56,Good morning Flint! #MINOW #Feminism #MittenState
1111592210368208897,2019-03-29 11:33:29,Since I'm on the road today (and I brought my bag with me!) #ThisIsHowIRide https://t.co/tpZR4FKIEa
1110541730879815680,2019-03-26 13:59:16,"History matters, truth matters, reparations matter. 

P.S. Hugo Boss designed SS uniforms? Why is this stuff not in… https://t.co/qhNr3v4IKg"
1110178525007544327,2019-03-25 13:56:01,Yellen Says She’s ‘Not a Fan of MMT’ as List of Detractors Grows https://t.co/eznnFpqmel
1110142468073422850,2019-03-25 11:32:44,"An interesting proposal from two NY reps, one GOP and one Dem. https://t.co/B5WcL2hC3Z"
1109927609838854147,2019-03-24 21:18:58,https://t.co/ktuZYheTaX
